"DESCRIPTION","DURATION IN MS","NAME","PARENT SUITE","START TIME","STATUS","STOP TIME","SUB SUITE","SUITE","TEST CLASS","TEST METHOD"
"Verify an attachment can be added to a test run","3337","Verify an attachment can be added to a test run","API regression tests","2026-07-19","passed","2026-07-19","Attachments functionality tests","API Tests","tests.api.AttachmentAPITest","addAttachmentToTestRun"
"Edit test case title via edit form","11628","Edit test case title via edit form","UI Regression tests","2026-07-19","passed","2026-07-19","Test cases functionality tests","UI Tests","tests.ui.TestCaseTest","editTestCaseTest"
"Create user group","12416","Verify group can be created","UI Regression tests","2026-07-19","passed","2026-07-19","Group management functionality tests","UI Tests","tests.ui.GroupTest","createGroupTest"
"Suite shows test cases count","19889","Suite shows test cases count","UI Regression tests","2026-07-19","passed","2026-07-19","Test suites functionality tests","UI Tests","tests.ui.TestSuiteTest","suiteShowsCasesCountTest"
"Login with invalid credentials shows error","5231","Login with invalid credentials shows error","UI Regression tests","2026-07-19","passed","2026-07-19","Authentication functionality tests","UI Tests","tests.ui.LoginTest","loginWithInvalidCredentialsTest"
"Verify the projects list can be retrieved","1904","Verify the projects list can be retrieved","API regression tests","2026-07-19","passed","2026-07-19","Projects API functionality tests","API Tests","tests.api.ProjectAPITest","getProjects"
"Delete test suite","22713","Delete test suite","UI Regression tests","2026-07-19","passed","2026-07-19","Test suites functionality tests","UI Tests","tests.ui.TestSuiteTest","deleteSuiteTest"
"Verify the created section with the test case can be deleted","1065","Verify the created section with the test case can be deleted","API regression tests","2026-07-19","passed","2026-07-19","Test cases API functionality tests","API Tests","tests.api.TestCaseAPITest","deleteTestCaseSection"
"Move test case to another section via edit form","13696","Move test case to another section via edit form","UI Regression tests","2026-07-19","passed","2026-07-19","Test cases functionality tests","UI Tests","tests.ui.TestCaseTest","moveTestCaseToSectionTest"
"Update role","13288","Verify role can be updated","UI Regression tests","2026-07-19","passed","2026-07-19","Role management functionality tests","UI Tests","tests.ui.RolesTest","updateRole"
"Verify a project can be created","1150","Verify a project can be created","API regression tests","2026-07-19","passed","2026-07-19","Projects API functionality tests","API Tests","tests.api.ProjectAPITest","createProject"
"Delete user group","12356","Verify group can be deleted","UI Regression tests","2026-07-19","passed","2026-07-19","Group management functionality tests","UI Tests","tests.ui.GroupTest","deleteGroupTest"
"Verify API authentication fails with invalid credentials","1064","Verify API authentication fails with invalid credentials","API regression tests","2026-07-19","passed","2026-07-19","API authentication functionality tests","API Tests","tests.api.AuthAPITest","checkInvalidCredentialsAuthentication"
"Verify created sections can be deleted","3290","Verify created sections can be deleted","API regression tests","2026-07-19","passed","2026-07-19","Sections functionality tests","API Tests","tests.api.SectionAPITest","deleteSections"
"Verify API authentication succeeds with valid credentials","5106","Verify API authentication succeeds with valid credentials","API regression tests","2026-07-19","passed","2026-07-19","API authentication functionality tests","API Tests","tests.api.AuthAPITest","checkValidCredentialsAuthentication"
"Login with invalid credentials shows error","5460","Login with invalid credentials shows error","UI Regression tests","2026-07-19","passed","2026-07-19","Authentication functionality tests","UI Tests","tests.ui.LoginTest","loginWithInvalidCredentialsTest"
"Edit project name","16167","Edit project name","UI Regression tests","2026-07-19","passed","2026-07-19","Project management functionality tests","UI Tests","tests.ui.ProjectsTest","editProjectNameTest"
"Filter tests in run by status","33616","Filter tests in run by status","UI Regression tests","2026-07-19","passed","2026-07-19","Test runs functionality tests","UI Tests","tests.ui.TestRunTest","filterByStatusTest"
"Create and then delete a test case","15818","Create and then delete a test case","UI Regression tests","2026-07-19","passed","2026-07-19","Test cases functionality tests","UI Tests","tests.ui.TestCaseTest","testCaseCreationAndDeletionTest"
"Change language","13513","Verify language can be changed","UI Regression tests","2026-07-19","passed","2026-07-19","Settings functionality tests","UI Tests","tests.ui.SettingsTest","changeLanguage"
"Deactivate user","15005","Verify user can be deactivated","UI Regression tests","2026-07-19","passed","2026-07-19","User management functionality tests","UI Tests","tests.ui.UserNRolesTest","deactivateUserTest"
"Open an existing test case","9390","Open an existing test case","UI Regression tests","2026-07-19","passed","2026-07-19","Test cases functionality tests","UI Tests","tests.ui.TestCaseTest","openTestCaseTest"
"Create and then delete a project","15101","Create and then delete a project","UI Regression tests","2026-07-19","passed","2026-07-19","Project management functionality tests","UI Tests","tests.ui.ProjectsTest","createAndDeleteProjectTest"
"Login with valid credentials","7075","Login with valid credentials","UI Smoke tests","2026-07-19","passed","2026-07-19","Authentication functionality tests","Smoke Tests","tests.ui.LoginTest","loginTest"
"Create a new test case","13498","Create a new test case","UI Smoke tests","2026-07-19","passed","2026-07-19","Test cases functionality tests","Smoke Tests","tests.ui.TestCaseTest","testCaseCreationTest"
"Create milestone","20396","Verify milestone can be created","UI Regression tests","2026-07-19","passed","2026-07-19","Milestones functionality tests","UI Tests","tests.ui.MilestoneTest","createMilestoneTest"
"Log out from the application","8120","Log out from the application","UI Regression tests","2026-07-19","passed","2026-07-19","Authentication functionality tests","UI Tests","tests.ui.LoginTest","logOutTest"
"Update user data","13052","Verify user data can be updated","UI Regression tests","2026-07-19","passed","2026-07-19","User management functionality tests","UI Tests","tests.ui.UserNRolesTest","updateUserDataTest"
"Verify a test case title can be updated","1067","Verify a test case title can be updated","API regression tests","2026-07-19","passed","2026-07-19","Test cases API functionality tests","API Tests","tests.api.TestCaseAPITest","updateTestCase"
"Close test run","32715","Close test run","UI Regression tests","2026-07-19","passed","2026-07-19","Test runs functionality tests","UI Tests","tests.ui.TestRunTest","closeRunTest"
"Verify a test case attachment can be deleted","3088","Verify a test case attachment can be deleted","API regression tests","2026-07-19","passed","2026-07-19","Attachments functionality tests","API Tests","tests.api.AttachmentAPITest","deleteAttachmentFromTestCase"
"Verify an attachment can be added to a test case","4251","Verify an attachment can be added to a test case","API regression tests","2026-07-19","passed","2026-07-19","Attachments functionality tests","API Tests","tests.api.AttachmentAPITest","addAttachmentToTestCase"
"Update user group","13645","Verify group can be updated","UI Regression tests","2026-07-19","passed","2026-07-19","Group management functionality tests","UI Tests","tests.ui.GroupTest","updateGroupTest"
"Delete milestone","23347","Verify milestone can be deleted","UI Regression tests","2026-07-19","passed","2026-07-19","Milestones functionality tests","UI Tests","tests.ui.MilestoneTest","deleteMilestoneTest"
"Create test run","48183","Create test run","UI Smoke tests","2026-07-19","passed","2026-07-19","Test runs functionality tests","Smoke Tests","tests.ui.TestRunTest","createRunTest"
"Change test case priority","12698","Change test case priority","UI Regression tests","2026-07-19","passed","2026-07-19","Test cases functionality tests","UI Tests","tests.ui.TestCaseTest","changePriorityInTestCaseTest"
"Add passed result to a test","33801","Add passed result to a test","UI Regression tests","2026-07-19","passed","2026-07-19","Test runs functionality tests","UI Tests","tests.ui.TestRunTest","addPassedResultTest"
"Verify created test data can be deleted","2186","Verify created test data can be deleted","API regression tests","2026-07-19","passed","2026-07-19","Test runs API functionality tests","API Tests","tests.api.TestRunAPITest","deleteTestRunData"
"Verify a test run attachment can be retrieved","1054","Verify a test run attachment can be retrieved","API regression tests","2026-07-19","passed","2026-07-19","Attachments functionality tests","API Tests","tests.api.AttachmentAPITest","retrieveAttachmentFromTestRun"
"Update milestone","27816","Verify milestone can be updated","UI Regression tests","2026-07-19","passed","2026-07-19","Milestones functionality tests","UI Tests","tests.ui.MilestoneTest","updateMilestoneTest"
"Create user","14712","Verify user can be created","UI Regression tests","2026-07-19","passed","2026-07-19","User management functionality tests","UI Tests","tests.ui.UserNRolesTest","createUserTest"
"Verify a section can be moved into another section","3464","Verify a section can be moved into another section","API regression tests","2026-07-19","passed","2026-07-19","Sections functionality tests","API Tests","tests.api.SectionAPITest","moveSection"
"Create role","10907","Verify role can be created","UI Regression tests","2026-07-19","passed","2026-07-19","Role management functionality tests","UI Tests","tests.ui.RolesTest","createRole"
"Session expires after clearing browser cookies","7770","Session expires after clearing browser cookies","UI Regression tests","2026-07-19","passed","2026-07-19","Authentication functionality tests","UI Tests","tests.ui.LoginTest","sessionExpiredAfterCookieClear"
"Verify test run results can be retrieved","1051","Verify test run results can be retrieved","API regression tests","2026-07-19","passed","2026-07-19","Test runs API functionality tests","API Tests","tests.api.TestRunAPITest","getResultsForRun"
"Add failed result with attachment","49814","Add failed result with attachment","UI Regression tests","2026-07-19","passed","2026-07-19","Test runs functionality tests","UI Tests","tests.ui.TestRunTest","addFailedResultWithAttachmentTest"
"Verify a test run attachment can be deleted","3049","Verify a test run attachment can be deleted","API regression tests","2026-07-19","passed","2026-07-19","Attachments functionality tests","API Tests","tests.api.AttachmentAPITest","deleteAttachmentFromTestRun"
"Verify selection can be created","1411","Verify selection can be created","API regression tests","2026-07-19","passed","2026-07-19","Sections functionality tests","API Tests","tests.api.SectionAPITest","checkCreateSection"
"Verify the created project can be deleted","1205","Verify the created project can be deleted","API regression tests","2026-07-19","passed","2026-07-19","Projects API functionality tests","API Tests","tests.api.ProjectAPITest","deleteProject"
"Verify project test runs can be retrieved","4604","Verify project test runs can be retrieved","API regression tests","2026-07-19","passed","2026-07-19","Test runs API functionality tests","API Tests","tests.api.TestRunAPITest","getTestRuns"
"Check milestone data","27661","Verify milestone data is displayed","UI Regression tests","2026-07-19","passed","2026-07-19","Milestones functionality tests","UI Tests","tests.ui.MilestoneTest","checkMilestoneDataTest"
"Priority change is reflected in case history","12634","Priority change is reflected in case history","UI Regression tests","2026-07-19","passed","2026-07-19","Test cases functionality tests","UI Tests","tests.ui.TestCaseTest","priorityChangeInHistoryTest"
"Change color scheme","13089","Verify color scheme can be changed","UI Regression tests","2026-07-19","passed","2026-07-19","Settings functionality tests","UI Tests","tests.ui.SettingsTest","changeColorScheme"
"Verify a test case can be created","2201","Verify a test case can be created","API regression tests","2026-07-19","passed","2026-07-19","Test cases API functionality tests","API Tests","tests.api.TestCaseAPITest","createTestCase"
"View test run statistics","35658","View test run statistics","UI Regression tests","2026-07-19","passed","2026-07-19","Reports functionality tests","UI Tests","tests.ui.ReportTest","viewRunStatisticsTest"
"Create a new project","12192","Create a new project","UI Smoke tests","2026-07-19","passed","2026-07-19","Project management functionality tests","Smoke Tests","tests.ui.ProjectsTest","createProjectTest"
"Complete milestone","28549","Verify milestone can be completed","UI Regression tests","2026-07-19","passed","2026-07-19","Milestones functionality tests","UI Tests","tests.ui.MilestoneTest","completeMilestoneTest"
"Create test suite","18954","Create test suite","UI Smoke tests","2026-07-19","passed","2026-07-19","Test suites functionality tests","Smoke Tests","tests.ui.TestSuiteTest","createSuiteTest"
"Verify project test cases can be retrieved","1059","Verify project test cases can be retrieved","API regression tests","2026-07-19","passed","2026-07-19","Test cases API functionality tests","API Tests","tests.api.TestCaseAPITest","getTestCases"
"Add test case to suite","25186","Add test case to suite","UI Regression tests","2026-07-19","passed","2026-07-19","Test suites functionality tests","UI Tests","tests.ui.TestSuiteTest","addCaseToSuiteTest"
"Export run results to a file","32240","Export run results to a file","UI Regression tests","2026-07-19","passed","2026-07-19","Reports functionality tests","UI Tests","tests.ui.ReportTest","exportRunResultsTest"
"Verify a result can be added to a test run","1288","Verify a result can be added to a test run","API regression tests","2026-07-19","passed","2026-07-19","Test runs API functionality tests","API Tests","tests.api.TestRunAPITest","addResultForCase"
"Compare results of two runs","42374","Compare results of two runs","UI Regression tests","2026-07-19","passed","2026-07-19","Reports functionality tests","UI Tests","tests.ui.ReportTest","compareRunsTest"
"Verify a test case attachment can be retrieved","1030","Verify a test case attachment can be retrieved","API regression tests","2026-07-19","passed","2026-07-19","Attachments functionality tests","API Tests","tests.api.AttachmentAPITest","retrieveAttachmentFromTestCase"
"Fill a custom field (Preconditions) of a test case","11774","Fill a custom field of a test case","UI Regression tests","2026-07-19","passed","2026-07-19","Test cases functionality tests","UI Tests","tests.ui.TestCaseTest","fillCustomFieldTest"
"Verify a section can be updated","1170","Verify a section can be updated","API regression tests","2026-07-19","passed","2026-07-19","Sections functionality tests","API Tests","tests.api.SectionAPITest","updateSection"
"Delete role","12653","Verify role can be deleted","UI Regression tests","2026-07-19","passed","2026-07-19","Role management functionality tests","UI Tests","tests.ui.RolesTest","deleteRole"
"Update user's name","10839","Verify user's name can be updated","UI Regression tests","2026-07-19","passed","2026-07-19","Settings functionality tests","UI Tests","tests.ui.SettingsTest","updateUsersName"
