"DESCRIPTION","DURATION IN MS","NAME","PARENT SUITE","START TIME","STATUS","STOP TIME","SUB SUITE","SUITE","TEST CLASS","TEST METHOD"
"Create user group","11635","Verify group can be created","UI Regression tests","2026-07-18","passed","2026-07-18","Group management functionality tests","UI Tests","tests.ui.GroupTest","createGroupTest"
"Filter tests in run by status","30075","Filter tests in run by status","UI Regression tests","2026-07-18","passed","2026-07-18","Test runs functionality tests","UI Tests","tests.ui.TestRunTest","filterByStatusTest"
"Verify the created project can be deleted","864","Verify the created project can be deleted","API regression tests","2026-07-18","passed","2026-07-18","Projects API functionality tests","API Tests","tests.api.ProjectAPITest","deleteProject"
"Update role","12234","Verify role can be updated","UI Regression tests","2026-07-18","passed","2026-07-18","Role management functionality tests","UI Tests","tests.ui.RolesTest","updateRole"
"Login with invalid credentials shows error","5306","Login with invalid credentials shows error","UI Regression tests","2026-07-18","passed","2026-07-18","Authentication functionality tests","UI Tests","tests.ui.LoginTest","loginWithInvalidCredentialsTest"
"Close test run","29311","Close test run","UI Regression tests","2026-07-18","passed","2026-07-18","Test runs functionality tests","UI Tests","tests.ui.TestRunTest","closeRunTest"
"Edit project name","15780","Edit project name","UI Regression tests","2026-07-18","passed","2026-07-18","Project management functionality tests","UI Tests","tests.ui.ProjectsTest","editProjectNameTest"
"Create milestone","17701","Verify milestone can be created","UI Regression tests","2026-07-18","passed","2026-07-18","Milestones functionality tests","UI Tests","tests.ui.MilestoneTest","createMilestoneTest"
"Verify a test case can be created","1486","Verify a test case can be created","API regression tests","2026-07-18","passed","2026-07-18","Test cases API functionality tests","API Tests","tests.api.TestCaseAPITest","createTestCase"
"Edit test case title via edit form","12068","Edit test case title via edit form","UI Regression tests","2026-07-18","passed","2026-07-18","Test cases functionality tests","UI Tests","tests.ui.TestCaseTest","editTestCaseTest"
"Update milestone","25313","Verify milestone can be updated","UI Regression tests","2026-07-18","passed","2026-07-18","Milestones functionality tests","UI Tests","tests.ui.MilestoneTest","updateMilestoneTest"
"Verify a section can be updated","873","Verify a section can be updated","API regression tests","2026-07-18","passed","2026-07-18","Sections functionality tests","API Tests","tests.api.SectionAPITest","updateSection"
"Verify test run results can be retrieved","848","Verify test run results can be retrieved","API regression tests","2026-07-18","passed","2026-07-18","Test runs API functionality tests","API Tests","tests.api.TestRunAPITest","getResultsForRun"
"Session expires after clearing browser cookies","7858","Session expires after clearing browser cookies","UI Regression tests","2026-07-18","passed","2026-07-18","Authentication functionality tests","UI Tests","tests.ui.LoginTest","sessionExpiredAfterCookieClear"
"Complete milestone","25777","Verify milestone can be completed","UI Regression tests","2026-07-18","passed","2026-07-18","Milestones functionality tests","UI Tests","tests.ui.MilestoneTest","completeMilestoneTest"
"Create a new test case","12874","Create a new test case","UI Smoke tests","2026-07-18","passed","2026-07-18","Test cases functionality tests","Smoke Tests","tests.ui.TestCaseTest","testCaseCreationTest"
"Delete role","11561","Verify role can be deleted","UI Regression tests","2026-07-18","passed","2026-07-18","Role management functionality tests","UI Tests","tests.ui.RolesTest","deleteRole"
"Update user's name","10032","Verify user's name can be updated","UI Regression tests","2026-07-18","passed","2026-07-18","Settings functionality tests","UI Tests","tests.ui.SettingsTest","updateUsersName"
"Verify a test run attachment can be retrieved","770","Verify a test run attachment can be retrieved","API regression tests","2026-07-18","passed","2026-07-18","Attachments functionality tests","API Tests","tests.api.AttachmentAPITest","retrieveAttachmentFromTestRun"
"Delete milestone","22302","Verify milestone can be deleted","UI Regression tests","2026-07-18","passed","2026-07-18","Milestones functionality tests","UI Tests","tests.ui.MilestoneTest","deleteMilestoneTest"
"Verify selection can be created","987","Verify selection can be created","API regression tests","2026-07-18","passed","2026-07-18","Sections functionality tests","API Tests","tests.api.SectionAPITest","checkCreateSection"
"Update user data","12430","Verify user data can be updated","UI Regression tests","2026-07-18","passed","2026-07-18","User management functionality tests","UI Tests","tests.ui.UserNRolesTest","updateUserDataTest"
"Verify the projects list can be retrieved","1487","Verify the projects list can be retrieved","API regression tests","2026-07-18","passed","2026-07-18","Projects API functionality tests","API Tests","tests.api.ProjectAPITest","getProjects"
"Deactivate user","13769","Verify user can be deactivated","UI Regression tests","2026-07-18","passed","2026-07-18","User management functionality tests","UI Tests","tests.ui.UserNRolesTest","deactivateUserTest"
"Verify API authentication succeeds with valid credentials","5095","Verify API authentication succeeds with valid credentials","API regression tests","2026-07-18","passed","2026-07-18","API authentication functionality tests","API Tests","tests.api.AuthAPITest","checkValidCredentialsAuthentication"
"Compare results of two runs","38973","Compare results of two runs","UI Regression tests","2026-07-18","passed","2026-07-18","Reports functionality tests","UI Tests","tests.ui.ReportTest","compareRunsTest"
"Verify an attachment can be added to a test case","3191","Verify an attachment can be added to a test case","API regression tests","2026-07-18","passed","2026-07-18","Attachments functionality tests","API Tests","tests.api.AttachmentAPITest","addAttachmentToTestCase"
"Login with valid credentials","8241","Login with valid credentials","UI Smoke tests","2026-07-18","passed","2026-07-18","Authentication functionality tests","Smoke Tests","tests.ui.LoginTest","loginTest"
"Create test run","35568","Create test run","UI Smoke tests","2026-07-18","passed","2026-07-18","Test runs functionality tests","Smoke Tests","tests.ui.TestRunTest","createRunTest"
"Verify the created section with the test case can be deleted","868","Verify the created section with the test case can be deleted","API regression tests","2026-07-18","passed","2026-07-18","Test cases API functionality tests","API Tests","tests.api.TestCaseAPITest","deleteTestCaseSection"
"Move test case to another section via edit form","12833","Move test case to another section via edit form","UI Regression tests","2026-07-18","passed","2026-07-18","Test cases functionality tests","UI Tests","tests.ui.TestCaseTest","moveTestCaseToSectionTest"
"Create a new project","12750","Create a new project","UI Smoke tests","2026-07-18","passed","2026-07-18","Project management functionality tests","Smoke Tests","tests.ui.ProjectsTest","createProjectTest"
"Fill a custom field (Preconditions) of a test case","11638","Fill a custom field of a test case","UI Regression tests","2026-07-18","passed","2026-07-18","Test cases functionality tests","UI Tests","tests.ui.TestCaseTest","fillCustomFieldTest"
"Update user group","12535","Verify group can be updated","UI Regression tests","2026-07-18","passed","2026-07-18","Group management functionality tests","UI Tests","tests.ui.GroupTest","updateGroupTest"
"Suite shows test cases count","17008","Suite shows test cases count","UI Regression tests","2026-07-18","passed","2026-07-18","Test suites functionality tests","UI Tests","tests.ui.TestSuiteTest","suiteShowsCasesCountTest"
"Verify a section can be moved into another section","2465","Verify a section can be moved into another section","API regression tests","2026-07-18","passed","2026-07-18","Sections functionality tests","API Tests","tests.api.SectionAPITest","moveSection"
"Verify project test cases can be retrieved","728","Verify project test cases can be retrieved","API regression tests","2026-07-18","passed","2026-07-18","Test cases API functionality tests","API Tests","tests.api.TestCaseAPITest","getTestCases"
"Add failed result with attachment","43577","Add failed result with attachment","UI Regression tests","2026-07-18","passed","2026-07-18","Test runs functionality tests","UI Tests","tests.ui.TestRunTest","addFailedResultWithAttachmentTest"
"Add passed result to a test","30653","Add passed result to a test","UI Regression tests","2026-07-18","passed","2026-07-18","Test runs functionality tests","UI Tests","tests.ui.TestRunTest","addPassedResultTest"
"Create and then delete a project","14021","Create and then delete a project","UI Regression tests","2026-07-18","passed","2026-07-18","Project management functionality tests","UI Tests","tests.ui.ProjectsTest","createAndDeleteProjectTest"
"Delete user group","11571","Verify group can be deleted","UI Regression tests","2026-07-18","passed","2026-07-18","Group management functionality tests","UI Tests","tests.ui.GroupTest","deleteGroupTest"
"Check milestone data","24017","Verify milestone data is displayed","UI Regression tests","2026-07-18","passed","2026-07-18","Milestones functionality tests","UI Tests","tests.ui.MilestoneTest","checkMilestoneDataTest"
"Change language","12029","Verify language can be changed","UI Regression tests","2026-07-18","passed","2026-07-18","Settings functionality tests","UI Tests","tests.ui.SettingsTest","changeLanguage"
"Verify project test runs can be retrieved","3191","Verify project test runs can be retrieved","API regression tests","2026-07-18","passed","2026-07-18","Test runs API functionality tests","API Tests","tests.api.TestRunAPITest","getTestRuns"
"Verify a project can be created","739","Verify a project can be created","API regression tests","2026-07-18","passed","2026-07-18","Projects API functionality tests","API Tests","tests.api.ProjectAPITest","createProject"
"Verify an attachment can be added to a test run","2171","Verify an attachment can be added to a test run","API regression tests","2026-07-18","passed","2026-07-18","Attachments functionality tests","API Tests","tests.api.AttachmentAPITest","addAttachmentToTestRun"
"Create test suite","18485","Create test suite","UI Smoke tests","2026-07-18","passed","2026-07-18","Test suites functionality tests","Smoke Tests","tests.ui.TestSuiteTest","createSuiteTest"
"Open an existing test case","9624","Open an existing test case","UI Regression tests","2026-07-18","passed","2026-07-18","Test cases functionality tests","UI Tests","tests.ui.TestCaseTest","openTestCaseTest"
"Verify a test case attachment can be retrieved","785","Verify a test case attachment can be retrieved","API regression tests","2026-07-18","passed","2026-07-18","Attachments functionality tests","API Tests","tests.api.AttachmentAPITest","retrieveAttachmentFromTestCase"
"View test run statistics","31215","View test run statistics","UI Regression tests","2026-07-18","passed","2026-07-18","Reports functionality tests","UI Tests","tests.ui.ReportTest","viewRunStatisticsTest"
"Create role","10509","Verify role can be created","UI Regression tests","2026-07-18","passed","2026-07-18","Role management functionality tests","UI Tests","tests.ui.RolesTest","createRole"
"Change color scheme","12901","Verify color scheme can be changed","UI Regression tests","2026-07-18","passed","2026-07-18","Settings functionality tests","UI Tests","tests.ui.SettingsTest","changeColorScheme"
"Verify a result can be added to a test run","992","Verify a result can be added to a test run","API regression tests","2026-07-18","passed","2026-07-18","Test runs API functionality tests","API Tests","tests.api.TestRunAPITest","addResultForCase"
"Login with invalid credentials shows error","5242","Login with invalid credentials shows error","UI Regression tests","2026-07-18","passed","2026-07-18","Authentication functionality tests","UI Tests","tests.ui.LoginTest","loginWithInvalidCredentialsTest"
"Verify a test case attachment can be deleted","2532","Verify a test case attachment can be deleted","API regression tests","2026-07-18","passed","2026-07-18","Attachments functionality tests","API Tests","tests.api.AttachmentAPITest","deleteAttachmentFromTestCase"
"Verify created test data can be deleted","1751","Verify created test data can be deleted","API regression tests","2026-07-18","passed","2026-07-18","Test runs API functionality tests","API Tests","tests.api.TestRunAPITest","deleteTestRunData"
"Priority change is reflected in case history","13251","Priority change is reflected in case history","UI Regression tests","2026-07-18","passed","2026-07-18","Test cases functionality tests","UI Tests","tests.ui.TestCaseTest","priorityChangeInHistoryTest"
"Verify API authentication fails with invalid credentials","661","Verify API authentication fails with invalid credentials","API regression tests","2026-07-18","passed","2026-07-18","API authentication functionality tests","API Tests","tests.api.AuthAPITest","checkInvalidCredentialsAuthentication"
"Export run results to a file","28830","Export run results to a file","UI Regression tests","2026-07-18","passed","2026-07-18","Reports functionality tests","UI Tests","tests.ui.ReportTest","exportRunResultsTest"
"Change test case priority","11895","Change test case priority","UI Regression tests","2026-07-18","passed","2026-07-18","Test cases functionality tests","UI Tests","tests.ui.TestCaseTest","changePriorityInTestCaseTest"
"Verify created sections can be deleted","2564","Verify created sections can be deleted","API regression tests","2026-07-18","passed","2026-07-18","Sections functionality tests","API Tests","tests.api.SectionAPITest","deleteSections"
"Verify a test case title can be updated","914","Verify a test case title can be updated","API regression tests","2026-07-18","passed","2026-07-18","Test cases API functionality tests","API Tests","tests.api.TestCaseAPITest","updateTestCase"
"Log out from the application","8095","Log out from the application","UI Regression tests","2026-07-18","passed","2026-07-18","Authentication functionality tests","UI Tests","tests.ui.LoginTest","logOutTest"
"Delete test suite","18864","Delete test suite","UI Regression tests","2026-07-18","passed","2026-07-18","Test suites functionality tests","UI Tests","tests.ui.TestSuiteTest","deleteSuiteTest"
"Add test case to suite","21210","Add test case to suite","UI Regression tests","2026-07-18","passed","2026-07-18","Test suites functionality tests","UI Tests","tests.ui.TestSuiteTest","addCaseToSuiteTest"
"Create user","14060","Verify user can be created","UI Regression tests","2026-07-18","passed","2026-07-18","User management functionality tests","UI Tests","tests.ui.UserNRolesTest","createUserTest"
"Verify a test run attachment can be deleted","2269","Verify a test run attachment can be deleted","API regression tests","2026-07-18","passed","2026-07-18","Attachments functionality tests","API Tests","tests.api.AttachmentAPITest","deleteAttachmentFromTestRun"
"Create and then delete a test case","15724","Create and then delete a test case","UI Regression tests","2026-07-18","passed","2026-07-18","Test cases functionality tests","UI Tests","tests.ui.TestCaseTest","testCaseCreationAndDeletionTest"
